<?xml version="1.0" encoding="UTF-8"?>
<producto xmlns:xsi="http://www.w3.org/2001/XMLSchema-instance"
          xsi:noNamespaceSchemaLocation="producto.xsd">
    <clave>ABC1234567890</clave>
    <nombre>Bujia de Iridio</nombre>
    <precio>249.99</precio>
    <cantidad>150</cantidad>
    <marca>BOSCH</marca>
    <fecha>29/10/2026</fecha>
    <categoria>Refacciones</categoria>
</producto>

